{"materials":[{"digest":"sha256:edfb3e5b48fbde0cc418f5c8f247f4c280b47a426f3706ca24cfe1953256d993","uri":"apps/memos/manifest-source.json"},{"digest":"sha256:7d6ff83dc3c645b9bc77afea46b49f63fd2d02c06c3bf5904ad16e050b7bef02","uri":"apps/umami/manifest-source.json"},{"digest":"sha256:bf1e10c839fdce393666ae75e0657742267106c5c7b5d43a59b5d34dcc9b4cdb","uri":"catalogue/plugin-lock.json"},{"digest":"sha256:22f7b0eff2c5bb8d0dafd0d03b7756bcf69a8c5aa1573e00487e873f03c2b539","uri":"ghcr.io/mysproutos/memos-plugin@sha256:22f7b0eff2c5bb8d0dafd0d03b7756bcf69a8c5aa1573e00487e873f03c2b539"},{"digest":"sha256:38adde1de3f544d9fae5bed47fd8739bf3a7a3f5b831705ff68ffcfc2f6d8a88","uri":"ghcr.io/mysproutos/umami-plugin@sha256:38adde1de3f544d9fae5bed47fd8739bf3a7a3f5b831705ff68ffcfc2f6d8a88"},{"digest":"sha256:680d7ea443bd4189ec885bc994bef27f1edd91b77f98d2bd0302de1b36f98792","uri":"packages/sprout-template-protocol/schema/request-v1.schema.json"},{"digest":"sha256:656330fd898e4f00821db27612ab18a3d6754870e06f4eb6f256ad2d6f5fdc3f","uri":"packages/sprout-template-protocol/schema/response-v1.schema.json"},{"digest":"sha256:9c93d3d0c311c1b504ebcc8712cca11848b6a9efcf2ed1e7189c58a94dbc0d3c","uri":"schema/app-manifest-v1.schema.json"},{"digest":"sha256:1ef7d8b471a0cfaa81a00e69c0ea88dfe6eec44c33089ab061bab3e78ab3306f","uri":"schema/catalogue-v1.schema.json"},{"digest":"sha256:2138a7615f608cde98d5898f45d8135d9d2376b146fad64fe9ee294d3b5c4ba7","uri":"schema/provenance-v1.schema.json"},{"digest":"sha256:c3628c536623429b98a806340a400a629ae9bf78d79ae8dcfe35c9cf376d87bb","uri":"tree:packages/sprout-template-protocol"},{"digest":"sha256:ce4735ff84c1d792b40412c5d7e0236105f9dfcf3caf0aeddef056099d36fbe6","uri":"tree:plugins/memos"},{"digest":"sha256:80cd599ef5f5896ce76b37c5038f0d8995ec77ee82c88203ad23431e4d98c183","uri":"tree:plugins/umami"}],"ref":"refs/heads/main","repository":"MySproutOS/Deployment-Templates","schema_version":1,"source_commit":"aaaaaaaaaaaaaaaaaaaaaaaaaaaaaaaaaaaaaaaa","subject":{"digest":"sha256:6a2c366ed38613b84268ed95a1686aa6f1a16aef8d848b112c274e7412d4a314","kind":"catalogue","name":"catalogue/catalogue.json"},"workflow":".github/workflows/publish.yml"}
